{
  "schemaVersion": 1,
  "metadataSource": "https://builds.dotnet.microsoft.com/dotnet/release-metadata/releases-index.json",
  "resolvedAt": "2026-07-22T00:00:00Z",
  "controlRuntime": {
    "version": "10.0.9",
    "targetFramework": "net10.0",
    "image": "mcr.microsoft.com/dotnet/aspnet:10.0.9-noble-amd64@sha256:68abecb063cf367fdce0a7f0ab5678beaa99f60c7f616df862ca2a51c387d4e7"
  },
  "coreClr": [
    {
      "id": "dotnet-core-2.0",
      "channel": "2.0",
      "version": "2.0.9",
      "runtimeCommit": "1632fa1589b0eee3277a8841ce1770e554ece037",
      "jitCommit": "1632fa1589b0eee3277a8841ce1770e554ece037",
      "releaseDate": "2018-07-10",
      "supportEndDate": "2018-10-01",
      "supportStatus": "legacy",
      "visibility": "visible",
      "referenceSetId": "netcoreapp2.0-ref",
      "referencePackage": {
        "id": "Microsoft.NETCore.App",
        "version": "2.0.9",
        "url": "https://api.nuget.org/v3-flatcontainer/microsoft.netcore.app/2.0.9/microsoft.netcore.app.2.0.9.nupkg",
        "sha512": "440df93975cad9e9e92f2150ac15ba3795b13d02c627c731e1254d3dad0f44b1263dc22ed4e99d88fcce96a681fbeede8c6598e4ede8dc22a43a0120b07cc3a8",
        "packageContentHash": "sha512-RA35OXXK2enpLyFQrBW6N5WxPQLGJ8cx4SVNPa0PRLEmPcIu1OmdiPzOlqaB++7ejGWY5O3o3CKkOgEgsHzDqA=="
      },
      "linuxBaseImage": "mcr.microsoft.com/dotnet/core/runtime:1.1.13-stretch@sha256:e5a5701f73eb4013d1b542c835113b240109cb4017a29032766b639103745314",
      "linux": {
        "url": "https://builds.dotnet.microsoft.com/dotnet/Runtime/2.0.9/dotnet-runtime-2.0.9-linux-x64.tar.gz",
        "sha512": "2b49b24ef712fbfc056e0fda95ff18037b4ec938ca8bb41f4c336b6a50870e922f5093684ac92c4bb8e1155b03c36d132d7f90817793f31c9ade5267fff6629a"
      },
      "windows": {
        "url": "https://builds.dotnet.microsoft.com/dotnet/Runtime/2.0.9/dotnet-runtime-2.0.9-win-x64.zip",
        "sha512": "4e03072925ca65f350112916eac8f442ee86f84de5fd8643d6db9eb96e2175351fdee0fb8ebed6a508b5ce2a3f73bdd4b7a084adc0c765c5249c019f601179f4"
      },
      "linuxCapability": {
        "capabilities": ["run"],
        "promotionState": "blocked",
        "blockedReason": "The net8 control bridge and target CoreCLR 2.0 runner have not passed the product image preflight."
      },
      "wineCapability": {
        "executionUser": "0:0",
        "capabilities": [],
        "promotionState": "blocked",
        "blockedReason": "Windows CoreCLR 2.x under Wine is outside the requested and tested matrix."
      }
    },
    {
      "id": "dotnet-core-2.1",
      "channel": "2.1",
      "version": "2.1.30",
      "runtimeCommit": "5e17f34de8b34fce04f665640e046d89e8991d00",
      "jitCommit": "5e17f34de8b34fce04f665640e046d89e8991d00",
      "releaseDate": "2021-08-19",
      "supportEndDate": "2021-08-21",
      "supportStatus": "legacy",
      "visibility": "visible",
      "referenceSetId": "netcoreapp2.1-ref",
      "referencePackage": {
        "id": "Microsoft.NETCore.App",
        "version": "2.1.30",
        "url": "https://api.nuget.org/v3-flatcontainer/microsoft.netcore.app/2.1.30/microsoft.netcore.app.2.1.30.nupkg",
        "sha512": "ae35df05e5d964e8b17932178bc17e1e47d749ffa26ae4d0834c0ef8265bcea0ce9b95cf7ac7361b2a58434a2d14e05b7db14fe1ac19ad9c0d6bad0b69856f61",
        "packageContentHash": "sha512-rjXfBeXZZOixeTIXi8F+HkfXSf+iauTQg0wO+CZbzqDOm5XPesc2GypYQ0otFOBbfbFP4awZrZwNa60LaYVvYQ=="
      },
      "linuxBaseImage": "mcr.microsoft.com/dotnet/core/runtime:2.1.30-stretch-slim@sha256:ea0a74b6a3804708cab2dd72caa6f9d58240dd862d7bccd748018d368ba8efe2",
      "linux": {
        "url": "https://builds.dotnet.microsoft.com/dotnet/Runtime/2.1.30/dotnet-runtime-2.1.30-linux-x64.tar.gz",
        "sha512": "b7433c9f03f7363759a044b50d8cca9486cfe402fdf62163696ba6a172e9839a140553e3d3298bb75c89dda2f6f4bec294847411f3fc2796fa4881a2b01a7178"
      },
      "windows": {
        "url": "https://builds.dotnet.microsoft.com/dotnet/Runtime/2.1.30/dotnet-runtime-2.1.30-win-x64.zip",
        "sha512": "3656c1a5dcf2196a34a06a01eb98851cad94663d654b8500b20b4a80cb5e7477b07172590b132805d3367bde2fc8dd7b7624a2f57f7ac425333e99424612b3fa"
      },
      "linuxCapability": {
        "capabilities": ["run"],
        "promotionState": "blocked",
        "blockedReason": "The net8 control bridge and target CoreCLR 2.1 runner have not passed the product image preflight."
      },
      "wineCapability": {
        "executionUser": "0:0",
        "capabilities": [],
        "promotionState": "blocked",
        "blockedReason": "Windows CoreCLR 2.x under Wine is outside the requested and tested matrix."
      }
    },
    {
      "id": "dotnet-core-2.2",
      "channel": "2.2",
      "version": "2.2.8",
      "runtimeCommit": "b9aa1abc510165cdc4c92e59d938def6f3eee0e1",
      "jitCommit": "b9aa1abc510165cdc4c92e59d938def6f3eee0e1",
      "releaseDate": "2019-11-19",
      "supportEndDate": "2019-12-23",
      "supportStatus": "legacy",
      "visibility": "visible",
      "referenceSetId": "netcoreapp2.2-ref",
      "referencePackage": {
        "id": "Microsoft.NETCore.App",
        "version": "2.2.8",
        "url": "https://api.nuget.org/v3-flatcontainer/microsoft.netcore.app/2.2.8/microsoft.netcore.app.2.2.8.nupkg",
        "sha512": "599d288eb5e2d8367ae8c5b176ce2353b65653232028e401ee0c90ef4a2faef6eb873bb9d173548e795f4d3ed9a56a312831807e7783a098d31e8264f8e6b544",
        "packageContentHash": "sha512-WZ0ojrXi2DZ66MWxds4jU7ZWUyMgKOQB7gyQ70ovrvbrhzu50XNUjnlfTT7ZpWoxKDGAfneDoJjTHoJk+Oa1RA=="
      },
      "linuxBaseImage": "mcr.microsoft.com/dotnet/core/runtime:2.2.8-stretch-slim@sha256:8f81aab10b63e73c0797fe728f3d0e9134387c02aa4c1c418eb30639f07964e5",
      "linux": {
        "url": "https://builds.dotnet.microsoft.com/dotnet/Runtime/2.2.8/dotnet-runtime-2.2.8-linux-x64.tar.gz",
        "sha512": "b818557b0090ec047be0fb2e5ffee212e23e8417e1b0164f455e3a880bf5b94967dc4c86d6ed82397af9acc1f7415674904f6225a1abff85d28d2a6d5de8073b"
      },
      "windows": {
        "url": "https://builds.dotnet.microsoft.com/dotnet/Runtime/2.2.8/dotnet-runtime-2.2.8-win-x64.zip",
        "sha512": "5864a40f662388761bc108510df9540b0b6672ae0f5a04cac71112ef0d1aa5781ffa3c856e919eed68eba6161f21a38c52f0e8850e8ecdf22609c42d2387d848"
      },
      "linuxCapability": {
        "capabilities": ["run"],
        "promotionState": "blocked",
        "blockedReason": "The net8 control bridge and target CoreCLR 2.2 runner have not passed the product image preflight."
      },
      "wineCapability": {
        "executionUser": "0:0",
        "capabilities": [],
        "promotionState": "blocked",
        "blockedReason": "Windows CoreCLR 2.x under Wine is outside the requested and tested matrix."
      }
    },
    {
      "id": "dotnet-core-3.0",
      "channel": "3.0",
      "version": "3.0.3",
      "runtimeCommit": "c03f2fe62663edec83d1bc12b4e9f11bd3de5d0e",
      "jitCommit": "c03f2fe62663edec83d1bc12b4e9f11bd3de5d0e",
      "releaseDate": "2020-02-18",
      "supportEndDate": "2020-03-03",
      "supportStatus": "legacy",
      "visibility": "visible",
      "referenceSetId": "netcoreapp3.0-ref",
      "referencePackage": {
        "id": "Microsoft.NETCore.App.Ref",
        "version": "3.0.1",
        "url": "https://api.nuget.org/v3-flatcontainer/microsoft.netcore.app.ref/3.0.1/microsoft.netcore.app.ref.3.0.1.nupkg",
        "sha512": "24f6d618b9cb48a2683fe13876a41df774084381aa5d7bfffa296dbb37758455c712a7f521ee6838aff1fd9fe8267e8f7854d2bce82179fdf64f8701522f42d4",
        "packageContentHash": "sha512-JPbWGLnLSKJoP+E4dqQd93QIQ4GqXXv/+iltuzd1hFXHEqf1Ie5oOK/x/Z/oJn6PeFTSvOghef32T4cBUi9C1A=="
      },
      "linuxBaseImage": "mcr.microsoft.com/dotnet/core/runtime:3.0.3-buster-slim@sha256:490b4a95e8d3cf651f648f05ebd12a8dfa53f0e0d73aed6159a443f6b2287650",
      "linux": {
        "url": "https://builds.dotnet.microsoft.com/dotnet/Runtime/3.0.3/dotnet-runtime-3.0.3-linux-x64.tar.gz",
        "sha512": "3d1f0ba2f293f43e087a8940a0f4736561f43b9f28bc5beda79a61f887e258543aea4dc71e88414a7c6e271dcda984a989afb62fc659a72223707a179cdde9c5"
      },
      "windows": {
        "url": "https://builds.dotnet.microsoft.com/dotnet/Runtime/3.0.3/dotnet-runtime-3.0.3-win-x64.zip",
        "sha512": "00428351d01f90e2951699f035d60068313f59e8ca5f07dfe228f1196644d2e1e4d7d8e80396bbc659001ac47df000c2f3b73433cba5f18ee7a39c0465daf60b"
      },
      "linuxCapability": {
        "capabilities": ["run"],
        "promotionState": "blocked",
        "blockedReason": "The net8 control bridge and target CoreCLR 3.0 runner have not passed the product image preflight."
      },
      "wineCapability": {
        "executionUser": "0:0",
        "capabilities": [],
        "promotionState": "blocked",
        "blockedReason": "Windows CoreCLR 3.x under Wine is outside the requested and tested matrix."
      }
    },
    {
      "id": "dotnet-core-3.1",
      "channel": "3.1",
      "version": "3.1.32",
      "runtimeCommit": "f94bb2c3ff432dcc4a6229eca2f978197bf06150",
      "jitCommit": "f94bb2c3ff432dcc4a6229eca2f978197bf06150",
      "releaseDate": "2022-12-13",
      "supportEndDate": "2022-12-13",
      "supportStatus": "legacy",
      "visibility": "visible",
      "referenceSetId": "netcoreapp3.1-ref",
      "referencePackage": {
        "id": "Microsoft.NETCore.App.Ref",
        "version": "3.1.0",
        "url": "https://api.nuget.org/v3-flatcontainer/microsoft.netcore.app.ref/3.1.0/microsoft.netcore.app.ref.3.1.0.nupkg",
        "sha512": "7135e5420cf1671e57b00215c3cb5c75886f3e9712700def1b7010fd27257aa327df648c042210a9eb681345f412a3d28d6dd2fa1c3fa51214962d26b23889f4",
        "packageContentHash": "sha512-cTXlQgzxZx5XsAIVw8tcdYhvPpcScA3vG3AQ/ScleqMn32SMBCIQqetoE0X0EqPSjW3S+hw/pRIUli0msjiJ9A=="
      },
      "linuxBaseImage": "mcr.microsoft.com/dotnet/core/runtime:3.1.32-buster-slim@sha256:341b5768c787690f502625e510041ffeb17851a6b40acffa8a1c717475e24057",
      "linux": {